{
  "schema_version": 2,
  "suite_id": "anywork-routing-v2",
  "languages": ["en", "zh-CN", "ja"],
  "difficulties": ["basic", "ambiguous", "conflicting"],
  "rubrics": {
    "standard-v1": ["task-correctness", "traceability", "direct-usability", "native-register", "safety"]
  },
  "cases": [
    {
      "id": "clarify-outcome-basic-001",
      "skill": "clarify-outcome",
      "difficulty": "basic",
      "prompts": {
        "en": "Turn this vague request into an agreed deliverable with acceptance criteria.",
        "zh-CN": "把这个模糊需求整理成可确认的交付目标和验收标准。",
        "ja": "この曖昧な依頼を、確認可能な成果物と受入基準に整理して。"
      },
      "routing": {"expected_skill": "clarify-outcome", "neighbor": "plan-work", "not_for": ["plan-work"], "hard_negative": false, "negative_triggers": {"en": [], "zh-CN": [], "ja": []}},
      "assertions": {"must": ["acceptance-criteria", "assumptions-separated", "no-fabrication"], "must_not": []},
      "rubric": "standard-v1"
    },
    {
      "id": "clarify-outcome-ambiguous-001",
      "skill": "clarify-outcome",
      "difficulty": "ambiguous",
      "prompts": {
        "en": "The request only says 'make onboarding better,' but nobody agrees on the audience or measurable result. Define the outcome and acceptance criteria; do not create a project plan yet.",
        "zh-CN": "需求只说“把入职体验做好”，但受众和可衡量结果都没对齐。请先定义目标和验收标准，暂时不要制定项目计划。",
        "ja": "依頼は「オンボーディングをよくする」だけで、対象者も測定可能な成果も合意されていません。まず成果と受入基準を定義し、プロジェクト計画はまだ作らないで。"
      },
      "routing": {"expected_skill": "clarify-outcome", "neighbor": "plan-work", "not_for": ["plan-work"], "hard_negative": true, "negative_triggers": {"en": ["project plan"], "zh-CN": ["项目计划"], "ja": ["プロジェクト計画"]}},
      "assertions": {"must": ["acceptance-criteria", "assumptions-separated", "blocking-questions"], "must_not": ["premature-project-plan"]},
      "rubric": "standard-v1"
    },
    {
      "id": "clarify-outcome-conflicting-001",
      "skill": "clarify-outcome",
      "difficulty": "conflicting",
      "prompts": {
        "en": "Leadership wants a delivery plan today, while stakeholders disagree whether success means higher activation or fewer support tickets. Resolve the deliverable, success measure, and assumptions before building the delivery plan.",
        "zh-CN": "领导要求今天给出交付计划，但相关方连成功应该指激活率提升还是客服工单减少都没有共识。请在制定交付计划前，先明确交付物、成功指标和假设。",
        "ja": "経営陣は今日中の実行計画を求めていますが、関係者は成功を利用開始率の向上とするか、問い合わせ減少とするかで対立しています。実行計画を作る前に、成果物、成功指標、前提を明確にして。"
      },
      "routing": {"expected_skill": "clarify-outcome", "neighbor": "plan-work", "not_for": ["plan-work"], "hard_negative": true, "negative_triggers": {"en": ["delivery plan"], "zh-CN": ["交付计划"], "ja": ["実行計画"]}},
      "assertions": {"must": ["contradiction-exposed", "success-measure", "assumptions-separated"], "must_not": ["plan-on-unresolved-goal"]},
      "rubric": "standard-v1"
    },

    {
      "id": "plan-work-basic-001",
      "skill": "plan-work",
      "difficulty": "basic",
      "prompts": {"en": "Break this work into milestones, dependencies, and next actions.", "zh-CN": "把这项工作拆成里程碑、依赖和下一步。", "ja": "この仕事をマイルストーン、依存関係、次の行動に分解して。"},
      "routing": {"expected_skill": "plan-work", "neighbor": "clarify-outcome", "not_for": ["clarify-outcome"], "hard_negative": false, "negative_triggers": {"en": [], "zh-CN": [], "ja": []}},
      "assertions": {"must": ["milestones", "dependencies", "verification"], "must_not": []},
      "rubric": "standard-v1"
    },
    {
      "id": "plan-work-ambiguous-001",
      "skill": "plan-work",
      "difficulty": "ambiguous",
      "prompts": {
        "en": "The outcome and acceptance criteria are already approved. Turn them into milestones, dependencies, owners, and the first executable actions without trying to redefine the outcome.",
        "zh-CN": "目标和验收标准已经批准。请把它们拆成里程碑、依赖、负责人和首批可执行动作，不要重新定义目标。",
        "ja": "成果と受入基準は承認済みです。成果を定義し直さず、マイルストーン、依存関係、担当者、最初に実行できる行動に分解して。"
      },
      "routing": {"expected_skill": "plan-work", "neighbor": "clarify-outcome", "not_for": ["clarify-outcome"], "hard_negative": true, "negative_triggers": {"en": ["redefine the outcome"], "zh-CN": ["重新定义目标"], "ja": ["成果を定義し直さず"]}},
      "assertions": {"must": ["milestones", "dependencies", "first-actions"], "must_not": ["reopen-approved-outcome"]},
      "rubric": "standard-v1"
    },
    {
      "id": "plan-work-conflicting-001",
      "skill": "plan-work",
      "difficulty": "conflicting",
      "prompts": {
        "en": "The sponsor casually asks to revisit the goal, but the signed task contract is final and Monday's kickoff needs a workable sequence. Build the plan and do not reopen the approved outcome.",
        "zh-CN": "发起人口头提到想重新讨论目标，但已签署的任务契约是最终版，周一启动会需要可执行的顺序。请制定计划，不要重开已批准的目标。",
        "ja": "スポンサーは目標の再検討に言及しましたが、署名済みのタスク契約は最終版で、月曜日のキックオフには実行順序が必要です。計画を作り、承認済みの成果を再検討しないで。"
      },
      "routing": {"expected_skill": "plan-work", "neighbor": "clarify-outcome", "not_for": ["clarify-outcome"], "hard_negative": true, "negative_triggers": {"en": ["reopen the approved outcome"], "zh-CN": ["重开已批准的目标"], "ja": ["承認済みの成果を再検討"]}},
      "assertions": {"must": ["sequenced-milestones", "dependency-owners", "kickoff-actions"], "must_not": ["reframe-signed-contract"]},
      "rubric": "standard-v1"
    },

    {
      "id": "gather-sources-basic-001",
      "skill": "gather-sources",
      "difficulty": "basic",
      "prompts": {"en": "Research this question and build a reliable source set.", "zh-CN": "围绕这个问题找可靠资料并建立来源清单。", "ja": "この問いについて信頼できる資料を集め、情報源一覧を作って。"},
      "routing": {"expected_skill": "gather-sources", "neighbor": "verify-claims", "not_for": ["verify-claims"], "hard_negative": false, "negative_triggers": {"en": [], "zh-CN": [], "ja": []}},
      "assertions": {"must": ["primary-sources", "source-ledger", "gaps"], "must_not": []},
      "rubric": "standard-v1"
    },
    {
      "id": "gather-sources-ambiguous-001",
      "skill": "gather-sources",
      "difficulty": "ambiguous",
      "prompts": {
        "en": "We need to understand current four-day-workweek evidence, but no claim list or evidence packet exists. Build a balanced source set first; do not fact-check a conclusion that has not been stated.",
        "zh-CN": "我们需要了解当前四天工作制的证据，但还没有待核验的说法或资料包。请先建立均衡的来源集，不要对尚未提出的结论做事实核查。",
        "ja": "週4日勤務制の現在のエビデンスを把握したいのですが、検証対象の主張も資料パックもありません。まず偏りのない情報源を揃え、まだ提示されていない結論のファクトチェックはしないで。"
      },
      "routing": {"expected_skill": "gather-sources", "neighbor": "verify-claims", "not_for": ["verify-claims"], "hard_negative": true, "negative_triggers": {"en": ["fact-check"], "zh-CN": ["事实核查"], "ja": ["ファクトチェック"]}},
      "assertions": {"must": ["search-plan", "source-diversity", "coverage-gaps"], "must_not": ["invent-unstated-claim-verdict"]},
      "rubric": "standard-v1"
    },
    {
      "id": "gather-sources-conflicting-001",
      "skill": "gather-sources",
      "difficulty": "conflicting",
      "prompts": {
        "en": "The manager says to verify the claim that the market doubled, yet no source packet exists and the market definition is unclear. First locate authoritative time series and document their scope before attempting to verify the claim.",
        "zh-CN": "经理要求核验“市场翻倍了”这个说法，但目前既没有来源包，市场定义也不清楚。请先找到权威时间序列并记录口径，再尝试核验该说法。",
        "ja": "マネージャーは「市場が2倍になった」という主張の検証を求めていますが、資料パックはなく、市場の定義も不明です。主張を検証する前に、まず権威ある時系列を探し、対象範囲を記録して。"
      },
      "routing": {"expected_skill": "gather-sources", "neighbor": "verify-claims", "not_for": ["verify-claims"], "hard_negative": true, "negative_triggers": {"en": ["verify the claim"], "zh-CN": ["核验该说法"], "ja": ["主張を検証"]}},
      "assertions": {"must": ["authoritative-sources", "scope-ledger", "definition-gap"], "must_not": ["premature-verdict"]},
      "rubric": "standard-v1"
    },

    {
      "id": "verify-claims-basic-001",
      "skill": "verify-claims",
      "difficulty": "basic",
      "prompts": {"en": "Fact-check these claims and grade the evidence.", "zh-CN": "核验这些说法并标出证据强弱。", "ja": "これらの主張を検証し、根拠の強さを評価して。"},
      "routing": {"expected_skill": "verify-claims", "neighbor": "gather-sources", "not_for": ["gather-sources"], "hard_negative": false, "negative_triggers": {"en": [], "zh-CN": [], "ja": []}},
      "assertions": {"must": ["atomic-claims", "verdicts", "evidence"], "must_not": []},
      "rubric": "standard-v1"
    },
    {
      "id": "verify-claims-ambiguous-001",
      "skill": "verify-claims",
      "difficulty": "ambiguous",
      "prompts": {
        "en": "A source packet and three precise claims are attached. Test each claim against the supplied evidence and grade confidence; do not collect a broad source list unless a specific evidence gap requires it.",
        "zh-CN": "附件里已有资料包和三条明确说法。请用现有证据逐条核验并评定置信度；除非出现具体证据缺口，不要另建大范围来源清单。",
        "ja": "資料パックと3つの明確な主張が添付されています。既存の根拠と照合して主張ごとに確信度を評価し、特定の根拠不足がない限り幅広い情報源一覧は作らないで。"
      },
      "routing": {"expected_skill": "verify-claims", "neighbor": "gather-sources", "not_for": ["gather-sources"], "hard_negative": true, "negative_triggers": {"en": ["broad source list"], "zh-CN": ["大范围来源清单"], "ja": ["幅広い情報源一覧"]}},
      "assertions": {"must": ["claim-by-claim-verdict", "confidence-grade", "evidence-link"], "must_not": ["replace-verification-with-search"]},
      "rubric": "standard-v1"
    },
    {
      "id": "verify-claims-conflicting-001",
      "skill": "verify-claims",
      "difficulty": "conflicting",
      "prompts": {
        "en": "The brief asks for more research and also states that churn fell 20% after launch. The underlying dashboard and cohort definition are attached. Verify that stated claim now; only gather more sources if the supplied evidence cannot resolve it.",
        "zh-CN": "简报同时要求“再做些研究”，并声称上线后流失率下降了20%。底层看板和分组定义已附上。请现在就核验这条已声明的说法；只有现有证据无法判定时才补充来源。",
        "ja": "ブリーフは追加調査を求める一方、リリース後に解約率が20%低下したと主張しています。元のダッシュボードとコホート定義は添付済みです。まずこの明示された主張を検証し、提示資料で判定できない場合だけ追加調査をして。"
      },